{
  "schemaVersion": "1.0.0",
  "schemaUrl": "https://ahasignals.com/data/filing-delta/revision-event-corpus/v1/schema.json",
  "artifact": {
    "id": "ai-infrastructure-filing-revision-event-corpus-2026-09-03-v1",
    "title": "AI Infrastructure Filing Revision Event Corpus",
    "version": "1.0.0",
    "canonicalUrl": "https://ahasignals.com/research/ai-infrastructure-filing-revision-event-corpus/",
    "repositoryUrl": "https://github.com/AhaSignals/ai-infrastructure-filing-cross-section/tree/main/revision-event-corpus/v1",
    "publishedAt": "2026-09-03",
    "knowledgeCutoff": "2026-09-01T00:00:00.000Z",
    "status": "frozen",
    "license": "CC BY 4.0",
    "creator": "AhaSignals"
  },
  "researchQuestion": "When did a matched filing value or its admissible evidence state become different from the state available to an earlier research decision?",
  "scope": {
    "observedIssuerCount": 7,
    "eventIssuerCount": 2,
    "noEventObservedIssuerCount": 5,
    "eventCount": 18,
    "comparativeValueDifferenceCount": 14,
    "sourceUpgradeCount": 4,
    "roundingCompatibleCount": 10,
    "presentationChangeCount": 4,
    "signFlipCount": 1,
    "issuerRestatementCount": 0
  },
  "eventDefinition": {
    "issuerComparativeValueDifference": "A matched fact has a different numerical value in a later issuer comparative filing. This label does not by itself assert error or restatement.",
    "researchReleaseSourceUpgrade": "A derived value is unchanged while the filing status, evidence object, primary-matrix eligibility or comparability tier changes between frozen research releases.",
    "noEventBoundary": "No event means no event was detected in the explicitly compared artifacts. It does not mean the issuer has never revised a filing value."
  },
  "pointInTimePolicy": {
    "knowledgeClock": "SEC acceptance timestamp for issuer facts; frozen release cutoff for research-release state.",
    "selectionRule": "At a decision time, use only the latest eligible state available on or before that time.",
    "noSilentOverwrite": "Later states and later research releases never replace an earlier frozen object.",
    "missingDataRule": "Missing or ineligible observations remain unavailable and are never converted to zero."
  },
  "coverage": [
    {
      "issuerId": "coreweave",
      "company": "CoreWeave, Inc.",
      "ticker": "CRWV",
      "cik": "0001769628",
      "observationScope": "0001769628-25-000041 to 0001769628-26-000366",
      "eventCount": 14,
      "status": "event-observed",
      "sourceArtifactUrl": "https://ahasignals.com/data/filing-delta/coreweave/revision-ledgers/crwv-revision-ledger-2026-q2-v1.json"
    },
    {
      "issuerId": "nvidia",
      "company": "NVIDIA Corporation",
      "ticker": "NVDA",
      "cik": "0001045810",
      "observationScope": "ai-infrastructure-cross-section-2026-08-31-v1 to ai-infrastructure-cross-section-2026-09-01-v2",
      "eventCount": 0,
      "status": "no-event-in-compared-artifacts",
      "sourceArtifactUrl": "https://ahasignals.com/data/filing-delta/cross-section/revision-ledgers/ai-infrastructure-cross-section-v1-to-v2-2026-09-01-v1.json"
    },
    {
      "issuerId": "amd",
      "company": "Advanced Micro Devices, Inc.",
      "ticker": "AMD",
      "cik": "0000002488",
      "observationScope": "ai-infrastructure-cross-section-2026-08-31-v1 to ai-infrastructure-cross-section-2026-09-01-v2",
      "eventCount": 0,
      "status": "no-event-in-compared-artifacts",
      "sourceArtifactUrl": "https://ahasignals.com/data/filing-delta/cross-section/revision-ledgers/ai-infrastructure-cross-section-v1-to-v2-2026-09-01-v1.json"
    },
    {
      "issuerId": "arista-networks",
      "company": "Arista Networks, Inc.",
      "ticker": "ANET",
      "cik": "0001596532",
      "observationScope": "ai-infrastructure-cross-section-2026-08-31-v1 to ai-infrastructure-cross-section-2026-09-01-v2",
      "eventCount": 0,
      "status": "no-event-in-compared-artifacts",
      "sourceArtifactUrl": "https://ahasignals.com/data/filing-delta/cross-section/revision-ledgers/ai-infrastructure-cross-section-v1-to-v2-2026-09-01-v1.json"
    },
    {
      "issuerId": "marvell",
      "company": "Marvell Technology, Inc.",
      "ticker": "MRVL",
      "cik": "0001835632",
      "observationScope": "ai-infrastructure-cross-section-2026-08-31-v1 to ai-infrastructure-cross-section-2026-09-01-v2",
      "eventCount": 0,
      "status": "no-event-in-compared-artifacts",
      "sourceArtifactUrl": "https://ahasignals.com/data/filing-delta/cross-section/revision-ledgers/ai-infrastructure-cross-section-v1-to-v2-2026-09-01-v1.json"
    },
    {
      "issuerId": "super-micro",
      "company": "Super Micro Computer, Inc.",
      "ticker": "SMCI",
      "cik": "0001375365",
      "observationScope": "ai-infrastructure-cross-section-2026-08-31-v1 to ai-infrastructure-cross-section-2026-09-01-v2",
      "eventCount": 4,
      "status": "event-observed",
      "sourceArtifactUrl": "https://ahasignals.com/data/filing-delta/cross-section/revision-ledgers/ai-infrastructure-cross-section-v1-to-v2-2026-09-01-v1.json"
    },
    {
      "issuerId": "dell",
      "company": "Dell Technologies Inc.",
      "ticker": "DELL",
      "cik": "0001571996",
      "observationScope": "ai-infrastructure-cross-section-2026-08-31-v1 to ai-infrastructure-cross-section-2026-09-01-v2",
      "eventCount": 0,
      "status": "no-event-in-compared-artifacts",
      "sourceArtifactUrl": "https://ahasignals.com/data/filing-delta/cross-section/revision-ledgers/ai-infrastructure-cross-section-v1-to-v2-2026-09-01-v1.json"
    }
  ],
  "events": [
    {
      "eventId": "REV-CRWV-001",
      "sequence": 1,
      "eventKind": "issuer-comparative-value-difference",
      "issuer": {
        "id": "coreweave",
        "company": "CoreWeave, Inc.",
        "ticker": "CRWV",
        "cik": "0001769628"
      },
      "metric": {
        "id": "revenue-h1-2025",
        "label": "Revenue",
        "taxonomy": "us-gaap:RevenueFromContractWithCustomerExcludingAssessedTax",
        "unit": "USD",
        "periodStart": "2025-01-01",
        "periodEnd": "2025-06-30"
      },
      "priorState": {
        "value": 2194420000,
        "acceptedAt": "2025-08-12T22:18:48Z",
        "accession": "0001769628-25-000041",
        "form": "10-Q",
        "filingUrl": "https://www.sec.gov/Archives/edgar/data/1769628/000176962825000041/crwv-20250630.htm",
        "sourceRole": "first-reported",
        "reportedPrecision": "thousand"
      },
      "laterState": {
        "value": 2194000000,
        "acceptedAt": "2026-08-11T23:24:42Z",
        "accession": "0001769628-26-000366",
        "form": "10-Q",
        "filingUrl": "https://www.sec.gov/Archives/edgar/data/1769628/000176962826000366/crwv-20260630.htm",
        "sourceRole": "later-comparative",
        "reportedPrecision": "million"
      },
      "change": {
        "valueChanged": true,
        "delta": -420000,
        "absoluteDelta": 420000,
        "relativeDelta": -0.00019139453705307096,
        "signChanged": false,
        "sourceStatusChanged": false,
        "classification": "rounding-compatible",
        "authority": "automatic-rule",
        "interpretation": "The $0.42 million difference is compatible with the later filing’s million-dollar presentation. It is not labeled here as a restatement."
      },
      "pointInTimePolicy": {
        "priorEligibleAt": "2025-08-12T22:18:48Z",
        "laterEligibleAt": "2026-08-11T23:24:42Z",
        "selectionRule": "Use the latest matched source state whose SEC acceptance timestamp is on or before the decision time.",
        "relatedBenchmarkCaseIds": []
      },
      "lineage": {
        "sourceArtifactId": "crwv-revision-ledger-2026-q2-v1",
        "sourceArtifactUrl": "https://ahasignals.com/data/filing-delta/coreweave/revision-ledgers/crwv-revision-ledger-2026-q2-v1.json",
        "sourceEntryId": "revenue-h1-2025",
        "sourceArtifactPayloadSha256": "16e2faa2f12baaa3e9c868cda2c0d1659e2bce3e4d17a427327ca07e8da89064"
      }
    },
    {
      "eventId": "REV-CRWV-002",
      "sequence": 2,
      "eventKind": "issuer-comparative-value-difference",
      "issuer": {
        "id": "coreweave",
        "company": "CoreWeave, Inc.",
        "ticker": "CRWV",
        "cik": "0001769628"
      },
      "metric": {
        "id": "operating-cash-flow-h1-2025",
        "label": "Operating cash flow",
        "taxonomy": "us-gaap:NetCashProvidedByUsedInOperatingActivities",
        "unit": "USD",
        "periodStart": "2025-01-01",
        "periodEnd": "2025-06-30"
      },
      "priorState": {
        "value": -190083000,
        "acceptedAt": "2025-08-12T22:18:48Z",
        "accession": "0001769628-25-000041",
        "form": "10-Q",
        "filingUrl": "https://www.sec.gov/Archives/edgar/data/1769628/000176962825000041/crwv-20250630.htm",
        "sourceRole": "first-reported",
        "reportedPrecision": "thousand"
      },
      "laterState": {
        "value": -190000000,
        "acceptedAt": "2026-08-11T23:24:42Z",
        "accession": "0001769628-26-000366",
        "form": "10-Q",
        "filingUrl": "https://www.sec.gov/Archives/edgar/data/1769628/000176962826000366/crwv-20260630.htm",
        "sourceRole": "later-comparative",
        "reportedPrecision": "million"
      },
      "change": {
        "valueChanged": true,
        "delta": 83000,
        "absoluteDelta": 83000,
        "relativeDelta": 0.00043665135756485325,
        "signChanged": false,
        "sourceStatusChanged": false,
        "classification": "rounding-compatible",
        "authority": "automatic-rule",
        "interpretation": "The later comparative value is consistent with rounding the first-reported value to the nearest million."
      },
      "pointInTimePolicy": {
        "priorEligibleAt": "2025-08-12T22:18:48Z",
        "laterEligibleAt": "2026-08-11T23:24:42Z",